{
  "agent_name": "research_analyst",
  "decision_type": "ingest_paper",
  "input_hash": "f1e2d3c4b5a6f1e2d3c4b5a6f1e2d3c4b5a6f1e2d3c4b5a6f1e2d3c4b5a6f1e2",
  "output_hash": "c3d4e5f6a1b2c3d4e5f6a1b2c3d4e5f6a1b2c3d4e5f6a1b2c3d4e5f6a1b2c3d4",
  "rationale": "Paper proposes dynamic vision token pruning at inference time based on attention entropy — tokens with entropy below a threshold are dropped before the LLM layers. Claimed 40% token reduction with <2% accuracy drop on VQAv2. Extracted hypothesis record with applicability check: the technique operates on attention maps before the LLM layers, which is architecture-agnostic given access to intermediate activations. Flagging implementation_difficulty as minor-code-change (requires hook into the vision encoder forward pass) rather than config-change.",
  "confidence_flags": {
    "claimed_token_reduction": "high",
    "accuracy_drop_at_40pct": "medium",
    "applicability_to_our_encoder": "low"
  },
  "timestamp": "2026-05-21T09:15:00+00:00",
  "llm_id": "claude-sonnet-4-5",
  "duration_ms": 18400
}
